{
  "schemaVersion": "0.1.0",
  "id": "model.blog-electrical",
  "name": "Domestic solar and battery",
  "components": [
    {
      "id": "grid",
      "type": "electrical.grid",
      "definitionVersion": "0.1.0",
      "name": "Grid",
      "parameters": {
        "maximumImportPowerKw": 1000,
        "maximumExportPowerKw": 1000
      },
      "initialState": {}
    },
    {
      "id": "bus",
      "type": "electrical.bus",
      "definitionVersion": "0.1.0",
      "name": "Electrical bus",
      "parameters": {},
      "initialState": {}
    },
    {
      "id": "pv",
      "type": "electrical.pv",
      "definitionVersion": "0.1.0",
      "name": "Solar PV",
      "parameters": {
        "generationSeriesId": "solar-generation",
        "profileMultiplier": 1
      },
      "initialState": {}
    },
    {
      "id": "load",
      "type": "electrical.load",
      "definitionVersion": "0.1.0",
      "name": "Electrical load",
      "parameters": {
        "demandSeriesId": "electrical-demand",
        "profileMultiplier": 1
      },
      "initialState": {}
    },
    {
      "id": "battery",
      "type": "electrical.battery",
      "definitionVersion": "0.1.0",
      "name": "Battery",
      "parameters": {
        "capacityKwh": 5,
        "maximumChargePowerKw": 3,
        "maximumDischargePowerKw": 3,
        "chargingEfficiency": 1,
        "dischargingEfficiency": 1
      },
      "initialState": {
        "storedEnergyKwh": 0
      }
    }
  ],
  "connections": [
    {
      "id": "grid-to-bus",
      "name": "Grid to bus",
      "from": {
        "componentId": "grid",
        "portId": "electricity"
      },
      "to": {
        "componentId": "bus",
        "portId": "terminal-1"
      }
    },
    {
      "id": "pv-to-bus",
      "name": "Solar PV to bus",
      "from": {
        "componentId": "pv",
        "portId": "electricity-out"
      },
      "to": {
        "componentId": "bus",
        "portId": "terminal-2"
      }
    },
    {
      "id": "bus-to-load",
      "name": "Bus to electrical load",
      "from": {
        "componentId": "bus",
        "portId": "terminal-3"
      },
      "to": {
        "componentId": "load",
        "portId": "electricity-in"
      }
    },
    {
      "id": "battery-to-bus",
      "name": "Battery to bus",
      "from": {
        "componentId": "battery",
        "portId": "electricity"
      },
      "to": {
        "componentId": "bus",
        "portId": "terminal-4"
      }
    }
  ]
}
